{
  "apiVersion": "cartograph/v1",
  "kind": "Flow",
  "metadata": {
    "id": "datasource",
    "name": "Data source"
  },
  "spec": {
    "for": "DataSource",
    "steps": [
      {
        "key": "definition",
        "title": "Definition",
        "guide": "Where the numbers come from, what form the source takes, and who keeps it.",
        "fields": [
          {
            "path": "/metadata/name",
            "control": "text"
          },
          {
            "path": "/spec/category",
            "control": "choice",
            "hint": "What kind of source it is."
          },
          {
            "path": "/spec/provenance",
            "control": "choice",
            "hint": "Whether your organisation runs it or someone outside does."
          },
          {
            "path": "/spec/team",
            "control": "reference",
            "hint": "The team that keeps it."
          },
          {
            "path": "/spec/keptBy",
            "control": "reference",
            "title": "Kept by",
            "hint": "Who keeps it, if it is kept outside your organisation."
          }
        ],
        "links": [
          {
            "kind": "KPI",
            "path": "/spec/sources",
            "needs": "holder"
          }
        ]
      },
      {
        "key": "access-quality",
        "title": "Access and quality",
        "guide": "How to get access, how often it changes, how records get in, and its known problems.",
        "fields": [
          {
            "path": "/spec/access",
            "control": "text",
            "hint": "How to get access, and what you need first."
          },
          {
            "path": "/spec/refresh",
            "control": "choice",
            "hint": "How often the numbers in it change."
          },
          {
            "path": "/spec/capture",
            "control": "choice",
            "hint": "If records start on paper, say how the paper becomes data."
          },
          {
            "path": "/spec/classification",
            "control": "choice",
            "hint": "How sensitive the contents are: public, internal, confidential or restricted."
          },
          {
            "path": "/spec/qualityIssues",
            "control": "sentence",
            "hint": "What is already known to be wrong with it."
          }
        ]
      },
      {
        "key": "metrics",
        "title": "Metrics",
        "guide": "Say what one entry of this source is, then the numbers it gives: each in words, and as an aggregation over its entries, so every indicator read from it uses the same count. Which warehouse model holds it is set outside Cartograph.",
        "optional": true,
        "fields": [
          {
            "path": "/spec/records",
            "control": "sentence",
            "hint": "Describe one entry, such as one delivery checked at a depot's intake."
          },
          {
            "path": "/spec/metrics",
            "control": "list",
            "hint": "Name each number, describe it in words, and write its aggregation, such as COUNT(*) WHERE passed = true. Write one aggregate over this source's own fields; leave tables and joins to the warehouse."
          }
        ]
      }
    ],
    "review": true
  }
}
